{
  "$schema": "https://json-schema.org/draft/2020-12/schema",
  "$id": "https://ultimate-brain.dev/schemas/v1/brain.schema.json",
  "title": "brain.json (v1)",
  "description": "Per-brain configuration. See spec/schema.md §12 and decisions 0014, 0018.",
  "type": "object",
  "required": [
    "schema_version",
    "owner",
    "budgets",
    "notion"
  ],
  "additionalProperties": false,
  "properties": {
    "schema_version": {
      "const": 1
    },
    "owner": {
      "type": "object",
      "required": [
        "name"
      ],
      "additionalProperties": false,
      "properties": {
        "name": {
          "type": "string",
          "minLength": 1
        },
        "person": {
          "type": "string",
          "pattern": "^per-[0-9abcdefghjkmnpqrstvwxyz]{8}$"
        }
      }
    },
    "budgets": {
      "type": "object",
      "additionalProperties": false,
      "properties": {
        "ingest_max_notes": {
          "type": "integer",
          "minimum": 1,
          "maximum": 20,
          "default": 8
        }
      }
    },
    "settings": {
      "type": "object",
      "additionalProperties": false,
      "properties": {
        "publish": {
          "enum": [
            "ask",
            "auto"
          ],
          "default": "ask"
        },
        "push": {
          "enum": [
            "auto",
            "remind"
          ],
          "default": "auto"
        },
        "unattended": {
          "description": "Unattended catch-up (decision 0051, spec/schema.md §12, cli.md §6.1).",
          "type": "object",
          "additionalProperties": false,
          "properties": {
            "max_inputs": {
              "description": "Inputs one unattended run takes in, oldest first.",
              "type": "integer",
              "minimum": 1,
              "default": 10
            }
          }
        }
      }
    },
    "modules": {
      "description": "Which optional modules are on (decision 0048, spec/schema.md §12). Absent: every module on (a brain made before 0.6.0). A key absent from a present block takes the module's default.",
      "type": "object",
      "additionalProperties": false,
      "properties": {
        "knowledge": {
          "type": "boolean",
          "default": true
        },
        "orgs": {
          "type": "boolean",
          "default": true
        },
        "documents": {
          "type": "boolean",
          "default": false
        },
        "reports": {
          "type": "boolean",
          "default": false
        },
        "tasks": {
          "type": "boolean",
          "default": false
        },
        "planning": {
          "type": "boolean",
          "default": false
        },
        "domains": {
          "type": "boolean",
          "default": false,
          "description": "Optional Domains around PARA (decision 0055, spec/capture-and-review.md §1). Off unless true, even in a brain whose `modules` block is absent (where every other module is on)."
        }
      }
    },
    "repos": {
      "type": "array",
      "items": {
        "type": "object",
        "required": [
          "name",
          "path",
          "area",
          "patterns",
          "commit"
        ],
        "additionalProperties": false,
        "properties": {
          "name": {
            "type": "string",
            "pattern": "^[a-z0-9]+(-[a-z0-9]+)*$"
          },
          "path": {
            "type": "string",
            "pattern": "^(/|~/)"
          },
          "area": {
            "type": "string",
            "pattern": "^area-[0-9abcdefghjkmnpqrstvwxyz]{8}$"
          },
          "patterns": {
            "type": "array",
            "minItems": 1,
            "items": {
              "type": "string",
              "minLength": 1
            }
          },
          "commit": {
            "type": "string",
            "pattern": "^([0-9a-f]{40})?$"
          }
        }
      }
    },
    "notion": {
      "type": "object",
      "required": [
        "databases",
        "tasks"
      ],
      "additionalProperties": false,
      "properties": {
        "databases": {
          "type": "object",
          "additionalProperties": false,
          "properties": {
            "areas": {
              "$ref": "#/$defs/dbId"
            },
            "goals": {
              "$ref": "#/$defs/dbId"
            },
            "key_results": {
              "$ref": "#/$defs/dbId"
            },
            "projects": {
              "$ref": "#/$defs/dbId"
            },
            "meetings": {
              "$ref": "#/$defs/dbId"
            },
            "people": {
              "$ref": "#/$defs/dbId"
            },
            "orgs": {
              "$ref": "#/$defs/dbId"
            },
            "decisions": {
              "$ref": "#/$defs/dbId"
            },
            "questions": {
              "$ref": "#/$defs/dbId"
            },
            "review": {
              "$ref": "#/$defs/dbId"
            },
            "capture_inbox": {
              "$ref": "#/$defs/dbId",
              "deprecated": true,
              "description": "Old name of inbox; read as inbox when inbox is absent. brain upgrade renames it."
            },
            "inbox": {
              "$ref": "#/$defs/dbId"
            },
            "concepts": {
              "$ref": "#/$defs/dbId"
            },
            "references": {
              "$ref": "#/$defs/dbId",
              "deprecated": true,
              "description": "Old name of documents (decision 0049); read as documents when documents is absent. brain upgrade renames it."
            },
            "documents": {
              "$ref": "#/$defs/dbId"
            }
          }
        },
        "tasks": {
          "type": "object",
          "required": [
            "database",
            "properties",
            "new_task_status"
          ],
          "additionalProperties": false,
          "properties": {
            "database": {
              "$ref": "#/$defs/dbId"
            },
            "properties": {
              "type": "object",
              "required": [
                "title"
              ],
              "additionalProperties": false,
              "properties": {
                "title": {
                  "type": "string"
                },
                "status": {
                  "type": "string"
                },
                "due": {
                  "type": "string"
                },
                "project": {
                  "type": "string"
                },
                "area": {
                  "type": "string"
                },
                "owner": {
                  "type": "string"
                },
                "meeting": {
                  "type": "string"
                },
                "meeting_url": {
                  "type": "string"
                },
                "source": {
                  "type": "string"
                },
                "brain_id": {
                  "type": "string"
                }
              }
            },
            "new_task_status": {
              "type": "string"
            },
            "status_type": {
              "enum": [
                "status",
                "select"
              ]
            },
            "wont_do_status": {
              "type": "string",
              "description": "The Tasks status option meaning closed without doing it (decision 0055, spec/capture-and-review.md §2). Absent: \"Won't Do\"."
            }
          },
          "allOf": [
            {
              "if": {
                "properties": {
                  "database": {
                    "minLength": 1
                  }
                },
                "required": [
                  "database"
                ]
              },
              "then": {
                "properties": {
                  "properties": {
                    "properties": {
                      "title": {
                        "minLength": 1
                      }
                    },
                    "anyOf": [
                      {
                        "properties": {
                          "meeting": {
                            "minLength": 1
                          }
                        },
                        "required": [
                          "meeting"
                        ]
                      },
                      {
                        "properties": {
                          "meeting_url": {
                            "minLength": 1
                          }
                        },
                        "required": [
                          "meeting_url"
                        ]
                      }
                    ]
                  }
                }
              }
            }
          ]
        }
      }
    }
  },
  "$defs": {
    "dbId": {
      "description": "Notion database id; empty string until `brain connect-notion` fills it.",
      "type": "string",
      "pattern": "^$|^[0-9a-f]{8}-?[0-9a-f]{4}-?[0-9a-f]{4}-?[0-9a-f]{4}-?[0-9a-f]{12}$"
    }
  }
}
