{
  "schema_version": 1,
  "owner": { "name": "Alex Example" },
  "budgets": { "ingest_max_notes": 8 },
  "notion": {
    "databases": {
      "areas": "a1000000-0000-4000-8000-000000000001",
      "goals": "a1000000-0000-4000-8000-000000000002",
      "key_results": "a1000000-0000-4000-8000-000000000003",
      "projects": "a1000000-0000-4000-8000-000000000004",
      "meetings": "a1000000-0000-4000-8000-000000000005",
      "people": "a1000000-0000-4000-8000-000000000006",
      "orgs": "a1000000-0000-4000-8000-000000000007",
      "decisions": "a1000000-0000-4000-8000-000000000008",
      "questions": "a1000000-0000-4000-8000-000000000009",
      "review": "a1000000-0000-4000-8000-00000000000a",
      "capture_inbox": ""
    },
    "tasks": {
      "database": "a1000000-0000-4000-8000-00000000000b",
      "properties": {
        "title": "Name", "status": "Status", "due": "Due", "project": "Project",
        "area": "Area", "owner": "", "meeting": "Meeting", "meeting_url": "", "brain_id": "Brain ID"
      },
      "new_task_status": "To Do"
    }
  }
}
