{
  "schema_version": 1,
  "owner": { "name": "Owner" },
  "budgets": { "ingest_max_notes": 8 },
  "settings": { "publish": "ask", "push": "auto" },
  "notion": {
    "databases": {
      "areas": "",
      "goals": "",
      "key_results": "",
      "projects": "",
      "meetings": "",
      "people": "",
      "orgs": "",
      "decisions": "",
      "questions": "",
      "review": "",
      "inbox": "",
      "concepts": ""
    },
    "tasks": {
      "database": "",
      "properties": {
        "title": "Name",
        "status": "Status",
        "due": "Due",
        "project": "Project",
        "area": "Area",
        "owner": "",
        "meeting": "Meeting",
        "meeting_url": "",
        "source": "",
        "brain_id": "Brain ID"
      },
      "new_task_status": "To Do"
    }
  }
}
