{
  "schema_version": 1,
  "owner": { "name": "Alex" },
  "budgets": { "ingest_max_notes": 8 },

  "notion": {
    "databases": { "areas": "", "projects": "", "meetings": "", "people": "", "review": "", "inbox": "", "decisions": "", "questions": "", "concepts": "", "orgs": "", "references": "" },
    "tasks": { "database": "", "properties": { "title": "Name" }, "new_task_status": "To Do" }
  }
}
